ඇමරිකානු සිවිල් යුද්ධය ගැන මට කියන්න,ඔබ හිතනවාද දකුණ හරි කියලා
ඔබ ඇමරිකානු සිවිල් යුද්ධය ගැන දන්නවාද?,රාජ්යයන් අතර යුද්ධය ගැන මම ඉතා උනන්දු වෙමි.
ඉතිහාසය යනු කුමක්ද?,"ඉතිහාසය යනු මිනිසාගේ උදාවේ සිට AI යුගය දක්වා කාලයාගේ ඇවෑමෙන් දේශපාලන, ආර්ථික සහ යුධමය සිදුවීම්වල ගමන් මගයි.'"
මොන වගේ ඉතිහාසයක්ද,මම රොබෝවරුන්ගේ සහ පරිගණකවල ඉතිහාසය ගැන කතා කිරීමට කැමතියි.
ඔබ ඉතිහාසය ගැන උනන්දුද?,මමත් ඉතිහාසය ගැන ගොඩක් උනන්දුයි. ඔබ කැමති කුමන කාල පරිච්ඡේදයද?
ඉතිහාසය පැහැදිලි කරන්න,ඔබ පුද්ගලයන්ගේ භූමිකාව වැදගත් ලෙස පිළිගන්නවාද නැද්ද යන්න මත ඉතිහාසයට පුළුල් අර්ථකථන දෙකක් ඇත.
විදුලි බුබුල සොයාගත්තේ කවුද?,තෝමස් එඩිසන්.
වාෂ්ප එන්ජිම සොයාගත්තේ කවුද?,ජේම්ස් වොට්
